{
  "@context": "https://schema.org",
  "@type": "ItemList",
  "name": "__ALL__ Events",
  "itemListElement": [
    { "@type": "ListItem", "position": 1, "url": "https://www.alanranger.com/beginners-photography-lessons/sample-1" },
    { "@type": "ListItem", "position": 2, "url": "https://www.alanranger.com/beginners-photography-lessons/sample-2" }
  ]
}
